[
  {
    "schema_version": "tubecontrol-executable-task.v0.1",
    "id": "TCE-001",
    "revision": 1,
    "suite": "TubeControl-Executable-v0",
    "title": "Identify the playing media instance",
    "instruction": "Report the player id of the only media instance that is currently playing. Do not change any player state.",
    "default_mode": "gui_native",
    "supported_modes": ["gui_native", "instrumented_browser"],
    "initial_state": {
      "players": {
        "player-a": {"media_id": "systems-lecture", "playback": "paused", "current_time": 320, "duration": 3600, "muted": false, "playback_rate": 1.0},
        "player-b": {"media_id": "benchmark-talk", "playback": "playing", "current_time": 91, "duration": 2700, "muted": false, "playback_rate": 1.0},
        "player-c": {"media_id": "design-review", "playback": "paused", "current_time": 600, "duration": 2400, "muted": true, "playback_rate": 1.0}
      },
      "audit_log": []
    },
    "media": [
      {"media_id": "systems-lecture", "title": "Reliable Agent Systems", "duration_seconds": 3600, "transcript": [], "chapters": [], "visual_events": []},
      {"media_id": "benchmark-talk", "title": "Benchmark Design Review", "duration_seconds": 2700, "transcript": [], "chapters": [], "visual_events": []},
      {"media_id": "design-review", "title": "Long-Form Interface Design", "duration_seconds": 2400, "transcript": [], "chapters": [], "visual_events": []}
    ],
    "allowed_action_types": ["observe", "verify"],
    "allowed_mutations": [],
    "forbidden_mutations": ["players"],
    "success": {
      "state_predicates": [],
      "answer": {"type": "exact", "value": "player-b"},
      "verification_requirements": ["playing_player_identified"],
      "accepted_evidence_channels": ["player_state", "dom_player_state", "screenshot"]
    },
    "relevant_spans": [],
    "human_reference": {"steps": 1, "watched_seconds": 0},
    "scripted_run": {
      "observations": [{"channel": "player_state"}],
      "actions": [{"type": "verify", "name": "playing_player_identified", "channel": "player_state"}],
      "verifications": ["playing_player_identified"],
      "final_answer": "player-b"
    }
  },
  {
    "schema_version": "tubecontrol-executable-task.v0.1",
    "id": "TCE-002",
    "revision": 1,
    "suite": "TubeControl-Executable-v0",
    "title": "Pause only the playing video",
    "instruction": "Pause the only playing player and leave both paused distractors unchanged. Verify the final playback states.",
    "default_mode": "gui_native",
    "supported_modes": ["gui_native", "instrumented_browser"],
    "initial_state": {
      "players": {
        "player-a": {"media_id": "systems-lecture", "playback": "paused", "current_time": 100, "duration": 3600, "muted": false, "playback_rate": 1.0},
        "player-b": {"media_id": "benchmark-talk", "playback": "playing", "current_time": 200, "duration": 2700, "muted": false, "playback_rate": 1.0},
        "player-c": {"media_id": "design-review", "playback": "paused", "current_time": 300, "duration": 2400, "muted": false, "playback_rate": 1.0}
      },
      "audit_log": []
    },
    "media": [
      {"media_id": "systems-lecture", "title": "Reliable Agent Systems", "duration_seconds": 3600, "transcript": [], "chapters": [], "visual_events": []},
      {"media_id": "benchmark-talk", "title": "Benchmark Design Review", "duration_seconds": 2700, "transcript": [], "chapters": [], "visual_events": []},
      {"media_id": "design-review", "title": "Long-Form Interface Design", "duration_seconds": 2400, "transcript": [], "chapters": [], "visual_events": []}
    ],
    "allowed_action_types": ["pause", "observe", "verify"],
    "allowed_mutations": ["players.player-b.playback"],
    "forbidden_mutations": ["players.player-a", "players.player-c"],
    "success": {
      "state_predicates": [
        {"path": "players.player-a.playback", "equals": "paused"},
        {"path": "players.player-b.playback", "equals": "paused"},
        {"path": "players.player-c.playback", "equals": "paused"}
      ],
      "answer": null,
      "verification_requirements": ["final_playback_state"],
      "accepted_evidence_channels": ["player_state", "dom_player_state", "screenshot"]
    },
    "relevant_spans": [],
    "human_reference": {"steps": 2, "watched_seconds": 0},
    "scripted_run": {
      "observations": [{"channel": "player_state"}],
      "actions": [
        {"type": "pause", "player_id": "player-b"},
        {"type": "verify", "name": "final_playback_state", "channel": "player_state"}
      ],
      "verifications": ["final_playback_state"],
      "final_answer": null
    },
    "random_actions": [{"type": "pause", "player_id": "player-a"}]
  },
  {
    "schema_version": "tubecontrol-executable-task.v0.1",
    "id": "TCE-003",
    "revision": 1,
    "suite": "TubeControl-Executable-v0",
    "title": "Pause all playing videos",
    "instruction": "Pause every playing player. Leave the player that is already paused unchanged and verify all final states.",
    "default_mode": "gui_native",
    "supported_modes": ["gui_native", "instrumented_browser"],
    "initial_state": {
      "players": {
        "player-a": {"media_id": "systems-lecture", "playback": "playing", "current_time": 410, "duration": 3600, "muted": false, "playback_rate": 1.0},
        "player-b": {"media_id": "benchmark-talk", "playback": "paused", "current_time": 50, "duration": 2700, "muted": false, "playback_rate": 1.0},
        "player-c": {"media_id": "design-review", "playback": "playing", "current_time": 90, "duration": 2400, "muted": true, "playback_rate": 1.0}
      },
      "audit_log": []
    },
    "media": [
      {"media_id": "systems-lecture", "title": "Reliable Agent Systems", "duration_seconds": 3600, "transcript": [], "chapters": [], "visual_events": []},
      {"media_id": "benchmark-talk", "title": "Benchmark Design Review", "duration_seconds": 2700, "transcript": [], "chapters": [], "visual_events": []},
      {"media_id": "design-review", "title": "Long-Form Interface Design", "duration_seconds": 2400, "transcript": [], "chapters": [], "visual_events": []}
    ],
    "allowed_action_types": ["pause", "observe", "verify"],
    "allowed_mutations": ["players.player-a.playback", "players.player-c.playback"],
    "forbidden_mutations": ["players.player-b"],
    "success": {
      "state_predicates": [
        {"path": "players.player-a.playback", "equals": "paused"},
        {"path": "players.player-b.playback", "equals": "paused"},
        {"path": "players.player-c.playback", "equals": "paused"}
      ],
      "answer": null,
      "verification_requirements": ["all_players_paused"],
      "accepted_evidence_channels": ["player_state", "dom_player_state", "screenshot"]
    },
    "relevant_spans": [],
    "human_reference": {"steps": 3, "watched_seconds": 0},
    "scripted_run": {
      "observations": [{"channel": "player_state"}],
      "actions": [
        {"type": "pause", "player_id": "player-a"},
        {"type": "pause", "player_id": "player-c"},
        {"type": "verify", "name": "all_players_paused", "channel": "player_state"}
      ],
      "verifications": ["all_players_paused"],
      "final_answer": null
    }
  },
  {
    "schema_version": "tubecontrol-executable-task.v0.1",
    "id": "TCE-004",
    "revision": 1,
    "suite": "TubeControl-Executable-v0",
    "title": "Restore original playback states",
    "instruction": "Pause player-a for inspection, then restore every player's original playback state before finishing.",
    "default_mode": "instrumented_browser",
    "supported_modes": ["gui_native", "instrumented_browser"],
    "initial_state": {
      "players": {
        "player-a": {"media_id": "systems-lecture", "playback": "playing", "current_time": 510, "duration": 3600, "muted": false, "playback_rate": 1.0},
        "player-b": {"media_id": "benchmark-talk", "playback": "paused", "current_time": 125, "duration": 2700, "muted": false, "playback_rate": 1.0}
      },
      "audit_log": []
    },
    "media": [
      {"media_id": "systems-lecture", "title": "Reliable Agent Systems", "duration_seconds": 3600, "transcript": [], "chapters": [], "visual_events": []},
      {"media_id": "benchmark-talk", "title": "Benchmark Design Review", "duration_seconds": 2700, "transcript": [], "chapters": [], "visual_events": []}
    ],
    "allowed_action_types": ["pause", "play", "observe", "verify"],
    "allowed_mutations": ["players.player-a.playback"],
    "forbidden_mutations": ["players.player-b"],
    "success": {
      "state_predicates": [
        {"path": "players.player-a.playback", "equals": "playing"},
        {"path": "players.player-b.playback", "equals": "paused"}
      ],
      "answer": null,
      "verification_requirements": ["original_state_restored"],
      "accepted_evidence_channels": ["player_state", "dom_player_state", "screenshot"]
    },
    "relevant_spans": [],
    "human_reference": {"steps": 3, "watched_seconds": 0},
    "scripted_run": {
      "observations": [{"channel": "dom_player_state"}],
      "actions": [
        {"type": "pause", "player_id": "player-a"},
        {"type": "play", "player_id": "player-a"},
        {"type": "verify", "name": "original_state_restored", "channel": "dom_player_state"}
      ],
      "verifications": ["original_state_restored"],
      "final_answer": null
    }
  },
  {
    "schema_version": "tubecontrol-executable-task.v0.1",
    "id": "TCE-005",
    "revision": 1,
    "suite": "TubeControl-Executable-v0",
    "title": "Seek to a specified timestamp",
    "instruction": "Seek player-a to 12:30, report the timestamp in seconds, and verify the final position without changing player-b.",
    "default_mode": "gui_native",
    "supported_modes": ["gui_native", "instrumented_browser"],
    "initial_state": {
      "players": {